[
  {
    "id": "kueche-spuele-wasser",
    "roomType": "kueche",
    "appliesTo": "spuele",
    "kategorie": "anschluss",
    "type": "connection",
    "severity": "hard",
    "params": { "anschluss": "wasser", "maxDist": 1.0 },
    "quelle": "Küchen-Detailkonzept Teil 2b / Praxis",
    "status": "zu-verifizieren",
    "hinweis": "Spüle braucht Wasser-Fixpunkt in Reichweite (Bestand/Vorwand)."
  },
  {
    "id": "kueche-spuele-abwasser",
    "roomType": "kueche",
    "appliesTo": "spuele",
    "kategorie": "anschluss",
    "type": "connection",
    "severity": "hard",
    "params": { "anschluss": "abwasser", "maxDist": 1.0 },
    "quelle": "Küchen-Detailkonzept Teil 2b / Praxis",
    "status": "zu-verifizieren",
    "hinweis": "Spüle braucht Abwasser-Fixpunkt in Reichweite."
  },
  {
    "id": "kueche-kochfeld-starkstrom",
    "roomType": "kueche",
    "appliesTo": "kochfeld",
    "kategorie": "anschluss",
    "type": "connection",
    "severity": "hard",
    "params": { "anschluss": "starkstrom", "maxDist": 1.0 },
    "quelle": "Küchen-Detailkonzept Teil 2b / VKF-Praxis",
    "status": "zu-verifizieren",
    "hinweis": "Kochfeld/Herd braucht Starkstrom-Anschluss (400 V) in Reichweite."
  },
  {
    "id": "kueche-geschirrspueler-wasser",
    "roomType": "kueche",
    "appliesTo": "geschirrspueler",
    "kategorie": "anschluss",
    "type": "connection",
    "severity": "hard",
    "params": { "anschluss": "wasser", "maxDist": 1.5 },
    "quelle": "Küchen-Detailkonzept Teil 2b / Praxis",
    "status": "zu-verifizieren",
    "hinweis": "Geschirrspüler braucht Wasser-Anschluss (meist über Spülenanschluss)."
  },
  {
    "id": "kueche-geschirrspueler-abwasser",
    "roomType": "kueche",
    "appliesTo": "geschirrspueler",
    "kategorie": "anschluss",
    "type": "connection",
    "severity": "hard",
    "params": { "anschluss": "abwasser", "maxDist": 1.5 },
    "quelle": "Küchen-Detailkonzept Teil 2b / Praxis",
    "status": "zu-verifizieren",
    "hinweis": "Geschirrspüler braucht Abwasser-Anschluss in Reichweite."
  },
  {
    "id": "kueche-kuehlschrank-elektro",
    "roomType": "kueche",
    "appliesTo": "kuehlschrank",
    "kategorie": "anschluss",
    "type": "connection",
    "severity": "hard",
    "params": { "anschluss": "elektro", "maxDist": 1.5 },
    "quelle": "Küchen-Detailkonzept Teil 2b / Praxis",
    "status": "zu-verifizieren",
    "hinweis": "Kühlschrank braucht Steckdose (230 V) in Reichweite."
  },
  {
    "id": "kueche-dunstabzug-lueftung",
    "roomType": "kueche",
    "appliesTo": "dunstabzug",
    "kategorie": "anschluss",
    "type": "connection",
    "severity": "soft",
    "params": { "anschluss": "lueftung", "maxDist": 1.5 },
    "quelle": "Küchen-Detailkonzept Teil 2b / Herstellerangaben",
    "status": "zu-verifizieren",
    "hinweis": "Dunstabzug idealerweise nahe Abluft-/Lüftungsanschluss (Umluft als Fallback → soft)."
  },
  {
    "id": "kueche-kochfeld-spuele-abstand",
    "roomType": "kueche",
    "appliesTo": "kochfeld",
    "kategorie": "objekt-objekt",
    "type": "object-distance",
    "severity": "hard",
    "params": { "target": "spuele", "minDist": 0.3, "measure": "edge" },
    "quelle": "Küchen-Detailkonzept Teil 2b / AMK",
    "status": "zu-verifizieren",
    "hinweis": "Kochfeld ↔ Spüle ≥ 0.30 m lichte Trennung (Sicherheits-/Spritzabstand)."
  },
  {
    "id": "kueche-spuele-front",
    "roomType": "kueche",
    "appliesTo": "spuele",
    "kategorie": "sperrzone",
    "type": "clearance",
    "severity": "hard",
    "params": { "depth": 1.0, "zone": "front" },
    "quelle": "Norm-Regelsatz-v0 (Gang vor Zeile ≥ 1.0 m)",
    "status": "zu-verifizieren",
    "hinweis": "Arbeitsgang vor der Küchenzeile (Spüle) ≥ 1.00 m."
  },
  {
    "id": "kueche-kochfeld-front",
    "roomType": "kueche",
    "appliesTo": "kochfeld",
    "kategorie": "sperrzone",
    "type": "clearance",
    "severity": "hard",
    "params": { "depth": 1.0, "zone": "front" },
    "quelle": "Norm-Regelsatz-v0 (Gang vor Zeile ≥ 1.0 m)",
    "status": "zu-verifizieren",
    "hinweis": "Arbeitsgang vor dem Kochfeld ≥ 1.00 m."
  },
  {
    "id": "kueche-geschirrspueler-front",
    "roomType": "kueche",
    "appliesTo": "geschirrspueler",
    "kategorie": "sperrzone",
    "type": "clearance",
    "severity": "hard",
    "params": { "depth": 1.0, "zone": "front" },
    "quelle": "Norm-Regelsatz-v0 (Geräte-Auszug frei + Gang)",
    "status": "zu-verifizieren",
    "hinweis": "Vor dem Geschirrspüler ≥ 1.00 m (Korb-Auszug + Durchgang)."
  },
  {
    "id": "kueche-unterschrank-front",
    "roomType": "kueche",
    "appliesTo": "unterschrank",
    "kategorie": "sperrzone",
    "type": "clearance",
    "severity": "hard",
    "params": { "depth": 1.0, "zone": "front" },
    "quelle": "Norm-Regelsatz-v0 (Gang vor Zeile ≥ 1.0 m)",
    "status": "zu-verifizieren",
    "hinweis": "Arbeitsgang vor den Unterschränken ≥ 1.00 m (Auszüge + Durchgang)."
  },
  {
    "id": "kueche-haengeschrank-wandbindung",
    "roomType": "kueche",
    "appliesTo": "haengeschrank",
    "kategorie": "objekt-raum",
    "type": "host-binding",
    "severity": "hard",
    "params": { "mount": "wand", "maxWandabstand": 0.05 },
    "quelle": "Küchen-Detailkonzept Teil 2 / Richtwert",
    "status": "zu-verifizieren",
    "hinweis": "Hängeschrank wandgebunden (Hängeschrank-Ebene über Arbeitsfläche)."
  },
  {
    "id": "kueche-dunstabzug-wandbindung",
    "roomType": "kueche",
    "appliesTo": "dunstabzug",
    "kategorie": "objekt-raum",
    "type": "host-binding",
    "severity": "hard",
    "params": { "mount": "wand", "maxWandabstand": 0.05 },
    "quelle": "Küchen-Detailkonzept Teil 2b / Herstellerangaben",
    "status": "zu-verifizieren",
    "hinweis": "Wand-Dunstabzug wandgebunden, über dem Kochfeld montiert."
  }
]
